<!ELEMENT rutas (ruta+)>
<!ELEMENT ruta (nombre, tipo, transporte, fechaInicio?, horaInicio?, duracion, agencia, descripcion, personasAdecuadas, lugarInicio, direccionInicio, coordenadasInicio, referencias, recomendacion, hitos,planimetria, altimetria)>
<!ELEMENT nombre (#PCDATA)>
<!ELEMENT planimetria (#PCDATA)>
<!ELEMENT altimetria (#PCDATA)>
<!ELEMENT tipo (#PCDATA)>
<!ELEMENT transporte (#PCDATA)>
<!ELEMENT fechaInicio (#PCDATA)>
<!ELEMENT horaInicio (#PCDATA)>
<!ELEMENT duracion (#PCDATA)>
<!ELEMENT agencia (#PCDATA)>
<!ELEMENT descripcion (#PCDATA)>
<!ELEMENT personasAdecuadas (#PCDATA)>
<!ELEMENT lugarInicio (#PCDATA)>
<!ELEMENT direccionInicio (#PCDATA)>
<!ELEMENT coordenadasInicio (longitud, latitud, altitud)>
<!ELEMENT longitud (#PCDATA)>
<!ELEMENT latitud (#PCDATA)>
<!ELEMENT altitud (#PCDATA)>
<!ELEMENT referencias (referencia+)>
<!ELEMENT referencia (#PCDATA)>
<!ELEMENT recomendacion (#PCDATA)>
<!ELEMENT hitos (hito+)>
<!ELEMENT hito (nombreHito, descripcionHito, coordenadasHito, distancia, galeriaFotografias, galeriaVideos?)>
<!ELEMENT nombreHito (#PCDATA)>
<!ELEMENT descripcionHito (#PCDATA)>
<!ELEMENT coordenadasHito (longitud, latitud, altitud)>
<!ELEMENT distancia (#PCDATA)>
<!ATTLIST distancia unidades CDATA #REQUIRED>
<!ELEMENT galeriaFotografias (fotografia+)>
<!ELEMENT fotografia (#PCDATA)>
<!ELEMENT galeriaVideos (video+)>
<!ELEMENT video (#PCDATA)>